,text,id,user,created_at
221,"@b56sjEfbjCr3Lw6 そう、まさにそうなんですよね。友達とか、イヤイヤされてても全然怒らず宥めてるし、私の子供でごめんって思っちゃいますよね😖
でも自分は精一杯家事育児仕事、やってるだけで、家族のため、子供のためで…
頑張りすぎなんでしょうねきっと😭😭😭",1398286393315446784,WokingmamaENARI,Fri May 28 14:33:49 +0000 2021
222,"@caasan2 共感ありがとうございます🙇‍♀️
結局、私はあれこれさっさとしたい性格なので、キッチンが片付いてないのに、放っておいて子供達との時間を作ることで、違うストレスがうまれそうです😭でも、今日やってみたら、久々にゲラゲラ笑う娘たちをみた気がします😓",1398285858197753866,WokingmamaENARI,Fri May 28 14:31:42 +0000 2021
223,@b56sjEfbjCr3Lw6 心優しいコメントありがとうございます🙇‍♀️元々イラチな性格だったので、イライラしても、私はこんなもんだろと思ってやり過ごしてきましたが、いよいよやり過ごすこともしんどくなってきてしまいました😣マ… https://t.co/nEMSnsH0XQ,1398252216255795203,WokingmamaENARI,Fri May 28 12:18:01 +0000 2021
224,弱音を吐きました。 https://t.co/x1BLze2mDQ,1398182635407507459,WokingmamaENARI,Fri May 28 07:41:31 +0000 2021
225,"おはようございます☀
金曜日だー！毎週木曜日は、担当企業に大量の納品があるから忙しい。そして金曜日は嵐がさったように暇。
さ、今日はのんびりいこー！",1398017431629565954,WokingmamaENARI,Thu May 27 20:45:04 +0000 2021
226,お弁当2人分作ったのに、お弁当いるの長女だけだった🤣,1397707719335841792,WokingmamaENARI,Thu May 27 00:14:23 +0000 2021
227,"おはようございます☀
今日は保育園のお弁当DAY!
大雨でかわいそうだけど、頑張って作るよー💕",1397652894422241280,WokingmamaENARI,Wed May 26 20:36:31 +0000 2021
228,だめだ…寝る前に見るんじゃなかった。おやすみなさい。 https://t.co/fMOcLsXPu6,1397551797917478916,WokingmamaENARI,Wed May 26 13:54:48 +0000 2021
229,"@seikoazuma サンサンスポンジ！？初耳です！
ググります😍",1397551123406344198,WokingmamaENARI,Wed May 26 13:52:07 +0000 2021
230,話題のダスキンスポンジ買ってみた！愛用の亀の子スポンジと、どっちが優秀？ https://t.co/oJJAfmP84J,1397520584364331013,WokingmamaENARI,Wed May 26 11:50:46 +0000 2021
231,@hinata1537 保育園で頑張ってくれてはいるんだろうけど、泣いた姿見てそこまで心配されると、なんか二重人格か？とか思っちゃう🤣🤣ww,1397375046872539141,WokingmamaENARI,Wed May 26 02:12:27 +0000 2021
232,"外面が良い娘たち。保育園に泣きながら登園したら、先生たちがめちゃくちゃ心配してくれる。
君たち、保育園でそんな泣かんの？",1397327990258757634,WokingmamaENARI,Tue May 25 23:05:28 +0000 2021
233,"トイレで頑張ってたら必ず誰か来る。
お願いやからトイレくらいゆっくりさせてくれ〜💩💩💩💩💩💩",1397320211762597888,WokingmamaENARI,Tue May 25 22:34:34 +0000 2021
234,@apiirira お大事に✨,1397311794826256385,WokingmamaENARI,Tue May 25 22:01:07 +0000 2021
235,"おはようございます☀
昨夜は寝落ちしてしまった😭
よく寝たー！",1397289817960902657,WokingmamaENARI,Tue May 25 20:33:47 +0000 2021
236,5人に1人が”マタハラ”被害?!4人に1人が”パタハラ”被害?! https://t.co/i3z5q3d6MW,1397062225248935937,WokingmamaENARI,Tue May 25 05:29:25 +0000 2021
237,"おはようございます☀
今朝の空、好き♡ https://t.co/E7k0FBZKkr",1396927258820894721,WokingmamaENARI,Mon May 24 20:33:06 +0000 2021
238,おやすみなさい💤,1396833514960556034,WokingmamaENARI,Mon May 24 14:20:36 +0000 2021
239,いるまみちお〜。,1396833481720664073,WokingmamaENARI,Mon May 24 14:20:28 +0000 2021
240,愛用のオマルご紹介！ベルギー産まれのスタイリッシュオマル！売り切れ…?! https://t.co/VyKK9tjvTg,1396808721536229378,WokingmamaENARI,Mon May 24 12:42:05 +0000 2021
241,近くに子供同伴可の少人数制のトレーニング施設があったから、行ってみたい💡と思って問い合わせしたら、コロナで子供同伴お断りだってー☹️,1396668866525155331,WokingmamaENARI,Mon May 24 03:26:21 +0000 2021
242,"おはようございます☀
今日からまた月曜日、頑張りましょう🙌
月曜日の朝は荷物が多いから、午前中雨じゃないだけで、もぅいい事1個目😆✨",1396565860865564673,WokingmamaENARI,Sun May 23 20:37:02 +0000 2021
243,"@seraserasan そうですよね💦
本当感謝です🙏兄は疲れきってましたww",1396359887064498180,WokingmamaENARI,Sun May 23 06:58:34 +0000 2021
244,"今日はパパが急遽仕事になったので、兄夫婦に娘2人を預けてネイル&amp;マツパです。
ごめんなさい、そしてありがとう😭",1396310522518114307,WokingmamaENARI,Sun May 23 03:42:25 +0000 2021
245,"おはようございます☀
めっちゃ寝たー！そしてめっちゃいい天気ー♡",1396249172206968832,WokingmamaENARI,Sat May 22 23:38:38 +0000 2021
246,"土曜日はパパのホットプレート料理しがちなわが家。
今日もそのつもりで段取りしてたのに、帰ってこないから私が焼きそばしました。
お、お、おいしい♡
パパのより断然おいしい🤫",1396051165322780675,WokingmamaENARI,Sat May 22 10:31:49 +0000 2021
247,"昨日さ、ブログの中でさ、長女は日中は完全におむつ取れてます！って書いたけどさ、今日英会話の授業中におもらしした🤣
「先生外国人やし、おしっこって言ってもわかってもらえないと思ったけど、英語も分からん…」
たしかに。そらそーや。こんなパターンは想像してなかった。",1395959322224381957,WokingmamaENARI,Sat May 22 04:26:52 +0000 2021
248,"朝から病院、薬局、スーパーコンプリート！
昼から英会話、公園、別のスーパー、頑張るぞ！",1395918370923376642,WokingmamaENARI,Sat May 22 01:44:09 +0000 2021
249,"おはようございます☀
やっと雨が上がったね！",1395865139186860033,WokingmamaENARI,Fri May 21 22:12:37 +0000 2021
250,"そろそろ次女のトイトレ。
忘れる前に長女のトイトレ書きました♡",1395714796260003840,WokingmamaENARI,Fri May 21 12:15:13 +0000 2021
251,https://t.co/tRi5XaHkQj,1395714667637469187,WokingmamaENARI,Fri May 21 12:14:42 +0000 2021
252,あ、できたww,1395713947257376773,WokingmamaENARI,Fri May 21 12:11:50 +0000 2021
253,ツイートできない、なんで？,1395713890428669958,WokingmamaENARI,Fri May 21 12:11:37 +0000 2021
254,喫煙所に座り込んでご飯食べるのほんまにやめて欲しい。ここはタバコを吸うところです。,1395577141656383493,WokingmamaENARI,Fri May 21 03:08:13 +0000 2021
255,"おはようございます☀
すごい降ったねー。ラスト金曜日がんばるぞー！",1395479507587407875,WokingmamaENARI,Thu May 20 20:40:16 +0000 2021
256,またこの季節がやってきたね。今年も食中毒にはなりませんように🙏しっかり対策しよう！ https://t.co/WQPV1vS4Np,1395342230429175810,WokingmamaENARI,Thu May 20 11:34:46 +0000 2021
257,「当選おめでとうございます！」ってゆうURL付きのDM、無視すれば良いんだけど、未読が貯まるのが嫌だからいちいち一回見て未読を消す作業、地味にうっとおしいです。,1395341545998471171,WokingmamaENARI,Thu May 20 11:32:03 +0000 2021
258,"おはようございます☀
20分寝坊、アラームは聞こえてました😓",1395119937304227840,WokingmamaENARI,Wed May 19 20:51:27 +0000 2021
259,"あのね、次女がね、洗面所にいたんですけどね、急に爆泣きでキッチンに走ってきてね、怖いー！って吐くまで泣くの。
彼女には何が見えているのだろうか。",1394957913400168448,WokingmamaENARI,Wed May 19 10:07:38 +0000 2021
260,自分の買い物をポチッとする時は、子供の買い物をポチッとするときにはない高揚感があります🙋‍♀️ww https://t.co/20tWcBoWYr,1394886025625755651,WokingmamaENARI,Wed May 19 05:21:58 +0000 2021
261,@ikuji_career 分かります！私もめっちゃ抜けました💦抜け方がすごすぎて、怖いですよねww,1394852018607505409,WokingmamaENARI,Wed May 19 03:06:50 +0000 2021
262,@tyami_hiseiki ギリギリセーフでした🙌わーい！,1394791954517413891,WokingmamaENARI,Tue May 18 23:08:10 +0000 2021
263,"おはようございます☀
昨日まで予報曇りだったのに、朝桃園時間雨に変わってるー☔️",1394754166560464898,WokingmamaENARI,Tue May 18 20:38:01 +0000 2021
264,ねたー！と思ったらおきたー！,1394620423464120324,WokingmamaENARI,Tue May 18 11:46:34 +0000 2021
265,"@tyami_hiseiki 最強雨女なのに止んでくれました♡
ムスコサンアメウタレタ？",1394593658809196550,WokingmamaENARI,Tue May 18 10:00:13 +0000 2021
266,フルーツ酸作ってみた♪ https://t.co/DveX9YK9Po,1394568099404206083,WokingmamaENARI,Tue May 18 08:18:39 +0000 2021
267,"オーマイガー！
カッパワスレーター！",1394543873720864768,WokingmamaENARI,Tue May 18 06:42:23 +0000 2021
268,"完全に自分のイライラで、長女に当たってしまった😖
しゅんとしたまま保育園行ってしまった😫
遅刻すると思って、イライラして急いで出た日は大概早く着く💦
30分で良いから時間戻って長女に謝りたい😭",1394428267210309634,WokingmamaENARI,Mon May 17 23:03:00 +0000 2021
269,@ikuji_career 最高の目覚めですね♡,1394427851437273093,WokingmamaENARI,Mon May 17 23:01:21 +0000 2021
270,おはようございます☀️,1394393493460582400,WokingmamaENARI,Mon May 17 20:44:50 +0000 2021
271,わーママさん！育児中ママさん！パパさん！ストレス発散してますか？ https://t.co/6tmbGMLbLM,1394204858962440197,WokingmamaENARI,Mon May 17 08:15:16 +0000 2021
272,"おはようございます☀️
早速雨ですね💦もぅ梅雨、早いなー。月曜日！頑張ろう！って気持ちが、雨により30%減です😕",1394048949388943363,WokingmamaENARI,Sun May 16 21:55:44 +0000 2021
273,"昔はよくさ、ご飯食べに行くとマッチあったよね？
あのマッチでタバコ吸うのが好きだったなぁー。",1393861242813485059,WokingmamaENARI,Sun May 16 09:29:51 +0000 2021
274,@hinata1537 おめでとうございます🎊㊗️,1393742444634677255,WokingmamaENARI,Sun May 16 01:37:47 +0000 2021
275,@hinata1537 本間に！私はレモン派です🍋,1393718554629861376,WokingmamaENARI,Sun May 16 00:02:52 +0000 2021
276,友達に愚痴るほどでもないし、母親やからすぐに怒りは消えるけど、今イラッとしたことを吐いてしまいました、すいません🥲,1393517043152945153,WokingmamaENARI,Sat May 15 10:42:08 +0000 2021
277,"「ハイボールの炭酸水、レモンしかないの？💢」って…。
嫌ならコンビニへどうぞ。",1393516871828209667,WokingmamaENARI,Sat May 15 10:41:27 +0000 2021
278,"母の日のご飯に誘って、私がお腹いっぱい！と言うと、「もっとゆっくり時間をかけて食べなさい。普段から一気に食べる癖がついてるからよ！」って…。
1歳4歳おって、ゆっくり食べる暇がどこにあんねん😤",1393516715531653126,WokingmamaENARI,Sat May 15 10:40:49 +0000 2021
279,@hinata1537 ありがとうございます✨,1393473603581091840,WokingmamaENARI,Sat May 15 07:49:31 +0000 2021
280,"2人目を作るきっかけについて書きました🙌
実は、結婚願望もなく子供嫌いだった私ww
でも2人目を望んだのも私でした。 https://t.co/NFraqeJuvq",1393397516868079619,WokingmamaENARI,Sat May 15 02:47:10 +0000 2021
281,"@hinata1537 え。めっちゃ食べてましたww
むしろ食べ残しが私のご飯みたいな感覚だった💦
辞めまーす🙌",1393397078559100929,WokingmamaENARI,Sat May 15 02:45:26 +0000 2021
282,"おはようございます☀
起きたら、先に起きてた長女がお着替えを済ませていました😆
そして、次女のお着替えまでしてくれてました♡
今日は良いスタートです！",1393323003761418240,WokingmamaENARI,Fri May 14 21:51:05 +0000 2021
283,"金曜日、仕事終わったらやる気が出ないと言いながら、帰ってハンバーグ作ったら、美味しさで疲れが少し飛んでった😆
やっぱり食は大事だね♡",1393168434364485636,WokingmamaENARI,Fri May 14 11:36:53 +0000 2021
284,"@saki_buppan_ ありがとうございます♡
子供たちもストレス溜まるから、たまには…😚",1393167123845840899,WokingmamaENARI,Fri May 14 11:31:40 +0000 2021
285,公園レポ！コロナでどこにも行けないけど、せめて公園くらい連れてってあげたいよね😚子供の体力はすごい！ https://t.co/eGYncU0dme,1393043205222932482,WokingmamaENARI,Fri May 14 03:19:16 +0000 2021
286,@ikuji_career おはようございます☀分かります、仕事終わった時点でスイッチ切れますよね💦,1392970282898378753,WokingmamaENARI,Thu May 13 22:29:30 +0000 2021
287,"おはようございます☀
20分寝坊した。金曜日だー！！！
ラストー！！！",1392945409450864641,WokingmamaENARI,Thu May 13 20:50:39 +0000 2021
288,"みなさんお子さんに、うるさいと言われたことありますか？
何歳のお子さんですか？ https://t.co/NBkSb420Ay",1392681220740243456,WokingmamaENARI,Thu May 13 03:20:52 +0000 2021
289,"@Kazuku12032247 おはようございます！
最高の始まりではないですが、どこかで挽回できる出来事が起こりますように🙏
今日も頑張りましょう🙌",1392607397454106624,WokingmamaENARI,Wed May 12 22:27:31 +0000 2021
290,"@sorana_su おはようございます☀
本当にイヤイヤ期恐ろしい💦
1人目より2人目の方が激しく感じるし😭
働くママにとって、朝は止まってる暇本当にないのに💦
今日も頑張りましょう🙌",1392607251886604288,WokingmamaENARI,Wed May 12 22:26:56 +0000 2021
291,"おはようございます。
朝から牛乳2回こぼされ、怒鳴りまくり。手が当たってしまった、とかならまだ分かるけど、面白がってコップひっくり返すからまぢ腹立つー。なんなんこの、2歳前後の面白がってこぼす行為は？",1392602874761207808,WokingmamaENARI,Wed May 12 22:09:33 +0000 2021
292,"@takafumin0707 こないだももにくのつもりが間違えてむね肉を買ってしまって、普通に焼いたら硬くなってすごい不評でした💦
このレシピなら喜んでくれそう😋",1392440647198543879,WokingmamaENARI,Wed May 12 11:24:55 +0000 2021
293,@yuyuko_yuyu すごいです👏お疲れ様ですっ！♡,1392440054019067909,WokingmamaENARI,Wed May 12 11:22:33 +0000 2021
294,4歳児、1歳児と行ったグランピングレポ！ https://t.co/vHPs8q1d3V,1392325519937445896,WokingmamaENARI,Wed May 12 03:47:26 +0000 2021
295,"@ikuji_career なんか一度なるとなりやすいそうですね💦
これから結膜炎とのお付き合いが始まりそうです😭",1392317928767311873,WokingmamaENARI,Wed May 12 03:17:16 +0000 2021
296,@ikuji_career 結膜炎でしたー💦,1392269411063455749,WokingmamaENARI,Wed May 12 00:04:29 +0000 2021
297,"次女が起きてきた時から、すごい目腫れてて充血してるんですけど、結膜炎でしょうか？💦
これって眼科で良いんですよね？💦",1392257599899242498,WokingmamaENARI,Tue May 11 23:17:33 +0000 2021
298,@furukaw38221345 ありがとうございます😊,1392240884423430145,WokingmamaENARI,Tue May 11 22:11:08 +0000 2021
299,"おはようございます☀
昨日はやっぱりしんどすぎて、21時に就寝。
今は、寝ぼけてて自分の体調分からんww",1392216195386933248,WokingmamaENARI,Tue May 11 20:33:01 +0000 2021
300,おぉー、揺れたねー。,1392000144627814401,WokingmamaENARI,Tue May 11 06:14:31 +0000 2021
301,@E8bMdEd7ahsjw5a ありがとうございます😭,1391930070852280322,WokingmamaENARI,Tue May 11 01:36:04 +0000 2021
302,"朝から謎の胃痛腹痛。30分横になればましになるんやろうけど、止まってる時間はない💦
腹痛で遅刻する勇気もない😭
気合いで乗り切れー！！",1391884215579410434,WokingmamaENARI,Mon May 10 22:33:51 +0000 2021
303,@blogeraloe 同じくです🙋‍♀️,1391877657650810885,WokingmamaENARI,Mon May 10 22:07:48 +0000 2021
304,"おはようございます☀
昨日は私にとって記念すべき日になりました！
4歳7ヶ月の長女に、初めて「うるさい！」と言われました🤣🤣
末恐ろしいわ🤣🤣🤣
#うるさい記念日",1391875556765933568,WokingmamaENARI,Mon May 10 21:59:27 +0000 2021
305,@takafumin0707 素敵です👏,1391520782090571777,WokingmamaENARI,Sun May 09 22:29:42 +0000 2021
306,@yuyuko_yuyu 新聞敷き詰め作戦で、乗り切りましょう🤣,1391520612628135936,WokingmamaENARI,Sun May 09 22:29:01 +0000 2021
307,"おはようございます☀
夢心地な2日間が終わった。
今日から7月まで祝日ないねー。
さ！働くぞー！！！",1391510082563710980,WokingmamaENARI,Sun May 09 21:47:11 +0000 2021
308,@hikki0913 おはようございます😃,1390846225700646915,WokingmamaENARI,Sat May 08 01:49:15 +0000 2021
309,GWレポ！初めの2日間はあいにくのお天気でしたね💦 https://t.co/xmxPDlJC0g,1390846108872503301,WokingmamaENARI,Sat May 08 01:48:47 +0000 2021
310,"@b56sjEfbjCr3Lw6 ありがとうございます♡
幸い帰る頃には、病んでいました🙌",1390612448042881024,WokingmamaENARI,Fri May 07 10:20:18 +0000 2021
311,H&amp;M、セールで買ったらめっちゃ安いよ子供服♡ https://t.co/1AYfnn9c61,1390612306485080069,WokingmamaENARI,Fri May 07 10:19:44 +0000 2021
312,"雨ってわかってるのにカッパ忘れた。
バイク…",1390562886624313344,WokingmamaENARI,Fri May 07 07:03:22 +0000 2021
313,"おはようございます☀
5時半おきの私。朝は2人が寝てる間に用意するのに、次女が起きてしまった💦",1390405966319947778,WokingmamaENARI,Thu May 06 20:39:49 +0000 2021
314,"月初だから、先月の売上集計データ作らないといけないんですけど、なんし連休明け。そして、今年度から私が引き継いだから、作り方分からん✋ww
朝8時半〜12時まで頑張ったけど、出来ませんでした。帰っていいですか？ww
#マクロ組めません",1390149102596280325,WokingmamaENARI,Thu May 06 03:39:08 +0000 2021
315,"@FUKUFUKU_LIFE1 まさに！
長女なんてもぅ4歳でよく分かってるのに、朝普通に仕事に出かけたパパが3日間帰ってこない戸惑い🤣
そしてそれを3日間宥める私🤣🤣",1390142931936235523,WokingmamaENARI,Thu May 06 03:14:37 +0000 2021
316,仕事で3日間帰ってこないパパが、子供達に何も言わずに、いつもと変わらない朝みたいに仕事に行くのが腹立つ朝です。,1390060462855786499,WokingmamaENARI,Wed May 05 21:46:55 +0000 2021
317,"おはようございます☀
なんだかんだ、GWめっちゃ遊んだ〜🙌（公園で）
今日から仕事かぁー、しかも月初。がんばろー！！！！",1390042235043942401,WokingmamaENARI,Wed May 05 20:34:29 +0000 2021
318,"おはようございます☀
昨夜、兄の家でご飯食べて、帰ってきて洗濯機だけ回して、子供達寝かしつけたら、寝落ちしてしまって、1時半に目が覚めて、洗濯機開けてみたら、オムツ入ってたー🤣🤣🤣🤣
夜中からポリマーまみれの洗濯物と洗濯機の処理してました💦",1389000437903204355,WokingmamaENARI,Sun May 02 23:34:45 +0000 2021
319,"おはようございます☀️
今日も昼から雨かよ。
こんな晴れてるのにー。",1388627362816806912,WokingmamaENARI,Sat May 01 22:52:17 +0000 2021
320,おはようございます。今日は昼から雨だね〜☔️,1388263442784481281,WokingmamaENARI,Fri Apr 30 22:46:12 +0000 2021
321,"明日から休み〜と思ってワイン入れて、窓の横のソファテーブルにグラス置いたら滑って落ちて、カーテンワインまみれ😭
ワイン落とす方法って何。。。
辛っ。",1388112108265476097,WokingmamaENARI,Fri Apr 30 12:44:51 +0000 2021
322,やっと休みー！と思うと、お迎えの時のテンションが高すぎて、先生達に笑われた😅,1388076969594703872,WokingmamaENARI,Fri Apr 30 10:25:13 +0000 2021
323,"今年31歳になったのですが、周りは出産ラッシュです！
出産祝い、迷う〜💦母になると余計迷うよね？ https://t.co/ccI7zFmNso",1388017125403500545,WokingmamaENARI,Fri Apr 30 06:27:25 +0000 2021
324,"おはようございます☀
雨止んで良かった〜！でも仕事ー。",1387867587598376962,WokingmamaENARI,Thu Apr 29 20:33:12 +0000 2021
325,明日仕事かよ〜。,1387740689207758852,WokingmamaENARI,Thu Apr 29 12:08:57 +0000 2021
326,"髪の毛切りました〜♡
子連れ美容室してきました💦 https://t.co/0akljpPxIX",1387738979999518721,WokingmamaENARI,Thu Apr 29 12:02:10 +0000 2021
327,"おはようございます☀
今日は髪切るぞ〜✂️",1387539886534582275,WokingmamaENARI,Wed Apr 28 22:51:02 +0000 2021
328,"長々と書いたのに消えちゃってた⁉️💦
先日、次女の泣きかたを見て、癇癪かも？と思いました😥色々調べてみたら、やっぱりそうっぽい。
まだ日は浅いですが、対処の仕方や対策など考えてみました。
先輩ママさん、色々教えてください🥺",1387363161825710082,WokingmamaENARI,Wed Apr 28 11:08:48 +0000 2021
329,#次女#癇癪 https://t.co/4cNxU72mLX,1387330045669109773,WokingmamaENARI,Wed Apr 28 08:57:12 +0000 2021
330,"おはようございます！
バイク通勤復活した途端に雨☔️
辛〜。",1387144675786514437,WokingmamaENARI,Tue Apr 27 20:40:37 +0000 2021
331,"@yattun_freedom ですよね、今更ですよね🤣
もぅ1年以上使ってるし。",1387000816595214340,WokingmamaENARI,Tue Apr 27 11:08:58 +0000 2021
332,洗濯マグちゃん。使ってるのに。。。,1386984602883923968,WokingmamaENARI,Tue Apr 27 10:04:32 +0000 2021
333,@kokoro_n20 同じですね💦家で何しよー、何食べよーって、毎日考える地獄🤮,1386966710943567876,WokingmamaENARI,Tue Apr 27 08:53:27 +0000 2021
334,"キャパオーバーした先週のお話。
#ワンオペ#疲れた#キャパオーバー https://t.co/zvSQpKL21R",1386923341869588480,WokingmamaENARI,Tue Apr 27 06:01:07 +0000 2021
335,"@b56sjEfbjCr3Lw6 ありがとうございます✨
先輩ママさんのお言葉沁みます♡
普段誰もそんな優しい言葉かけてくれないから余計に←
今日も無言テレビオフだ〜🤟",1386888711497863168,WokingmamaENARI,Tue Apr 27 03:43:30 +0000 2021
336,"GW何しますか？
どっこもいけそうにないけど、娘2人と家で缶詰は流石にきつい。。。",1386882528892657669,WokingmamaENARI,Tue Apr 27 03:18:56 +0000 2021
337,"@b56sjEfbjCr3Lw6 共感ありがとうございます😭
やっぱりそうですよね！w
早く寝てくれのイライラですよね☹️
だらだら服着て、テレビ見ながらだらだら歯磨きしてる姿を見たら、イライラして無言でテレビ消してます✋",1386880794539347972,WokingmamaENARI,Tue Apr 27 03:12:03 +0000 2021
338,"バイクがやっと治った〜！
今日から再びバイク通勤！",1386806921722617860,WokingmamaENARI,Mon Apr 26 22:18:30 +0000 2021
339,お風呂から上がったらイライラスイッチが入る。私のスイッチは何が起爆剤なんだ。,1386637437170946051,WokingmamaENARI,Mon Apr 26 11:05:02 +0000 2021
340,@teresudon2 月曜日からお休みは、会社員にとっては気まづいところです😅,1386505526196850692,WokingmamaENARI,Mon Apr 26 02:20:52 +0000 2021
341,朝から次女がゲロったから、お休みです😭,1386457909136003075,WokingmamaENARI,Sun Apr 25 23:11:39 +0000 2021
342,"おはようございます☀
今日から朝の交通量減ってるのかな？",1386437840855191554,WokingmamaENARI,Sun Apr 25 21:51:54 +0000 2021
343,"おはようございます☀
昨夜気づいてしましました、もしかしたら次女のあの泣きかたは…癇癪⁉︎",1386109662022434821,WokingmamaENARI,Sun Apr 25 00:07:50 +0000 2021
344,"@susan2021112 ありがとうございます😭
そんなふうに言っていただけて、嬉しいしやる気出ます♡
子育てがんばりましょう😆",1385956802542460936,WokingmamaENARI,Sat Apr 24 14:00:26 +0000 2021
345,今日#着飾る恋には理由があって の録画を見てたんですけど、#川口春奈 を見た4歳長女に「ママがこんなママやったら良かったのになぁー。」って言われました。できることならママもあんなママになりたいよ🤣🤣🤣,1385919209830420486,WokingmamaENARI,Sat Apr 24 11:31:03 +0000 2021
