,text,id,user,created_at
108,"おはようございます☀
今日から洗顔を変えてみた！思ってたより、悪くないかも💕",1412872197668966402,WokingmamaENARI,Wed Jul 07 20:32:36 +0000 2021
109,@1y6mbaby なんでもやってみて、ご家族に合う方法が見つかれば良いですね☺️,1412532166303522818,WokingmamaENARI,Tue Jul 06 22:01:26 +0000 2021
110,"おはようございます☀
めっちゃ寝坊したうえにめっちゃ降ってる〜☔️
つら。",1412531948765945856,WokingmamaENARI,Tue Jul 06 22:00:34 +0000 2021
111,"@1y6mbaby 我が家は上、2歳と私と主人がベットで、下の子はそのすぐ横にベビーベットを置いて寝かせていました👶
上は断乳済み、下の授乳はベットに腰掛けてしてました☺️どうしても泣き止まない時はリビングへ行ってあやしてました♪… https://t.co/x8Y0LvTvQ0",1412248590240542735,WokingmamaENARI,Tue Jul 06 03:14:36 +0000 2021
112,"おはようございます☀
今日も曇り空。でも暑さは昨日よりはまし⁉️
今日も頑張るぞー。(あまりやる気ないやつ)",1412147846061576208,WokingmamaENARI,Mon Jul 05 20:34:17 +0000 2021
113,"おはようございます☀
昨夜は暑すぎて思わずクーラーつけてしまった。
みなさんもぅ、夜クーラー付けてますか？",1411816865202982913,WokingmamaENARI,Sun Jul 04 22:39:05 +0000 2021
114,"@akitj0711 バイクです🏍ww
渋滞とか巻き込まれないし楽ですよ〜♪
逆に車だと保育園のお迎えが間に合わないんですよね💦",1411155027897376775,WokingmamaENARI,Sat Jul 03 02:49:11 +0000 2021
115,9時に家出て、ドラッグストア行って、コインランドリー行って乾燥してる間にスーパで買い物して、コインランドリー取りに行って、長女英会話送ってやっと一息。ふー。頑張った！！,1411154764675440641,WokingmamaENARI,Sat Jul 03 02:48:08 +0000 2021
116,"@akitj0711 前職は子育てへの理解が全くなく、さらに家から1時間半でした💦
今の職場はとても理解があるし家からバイクで15分くらいです🏍
大変でしたけど、結果今の方が断然楽です☺️",1411083486530654211,WokingmamaENARI,Fri Jul 02 22:04:54 +0000 2021
117,"大親友の2人目妊娠報告に、朝から""爆上げ""←初めて使ったww",1410737710499696644,WokingmamaENARI,Thu Jul 01 23:10:55 +0000 2021
118,"おはようございます☀
今週はあっという間であまり疲れを感じてなかったけど、今日は全然起きれなかった💦体は正直😅",1410702329439952896,WokingmamaENARI,Thu Jul 01 20:50:19 +0000 2021
119,"@akitj0711 腑に落ちるように言えれば、そりゃ💯でしょうけど、仕事、育児色んなことを抱えると常に💯ではいられませんよ☺️
ちゃんと振り返れてるだけで、すごいと思います👏",1410575595725938693,WokingmamaENARI,Thu Jul 01 12:26:43 +0000 2021
120,@akitj0711 そうです😎,1410575112382783489,WokingmamaENARI,Thu Jul 01 12:24:48 +0000 2021
121,@akitj0711 じゃあ在宅できなかったら、朝送ってってね！って感じですね😭,1410435440449052679,WokingmamaENARI,Thu Jul 01 03:09:48 +0000 2021
122,"なんだかイライラするなぁ🤔
なんだろう。
謙虚な気持ちを取り戻して、落ち着け自分！",1410415714125565952,WokingmamaENARI,Thu Jul 01 01:51:25 +0000 2021
123,"おはようございます☀
雨だね〜、涼しい💕",1410337877238505472,WokingmamaENARI,Wed Jun 30 20:42:07 +0000 2021
124,"帰りにサンドラッグ寄ったら、前の人がクーポンが併用できないことにつっかかって、10分くらい待たされたおかげで保育園のお迎え間に合わず、2人で延長600円🤣
イライラしながら作ったオムライスを食べたパパに「腕あげたなぁ！」と言われ、全て治りましたww",1410188265450217472,WokingmamaENARI,Wed Jun 30 10:47:37 +0000 2021
125,"@akitj0711 私は一度仕事辞めたので、4月入社なんですよね😅
だから、それでも貰えるのはありがたいなぁと思います💕",1410187850289598467,WokingmamaENARI,Wed Jun 30 10:45:58 +0000 2021
126,"@OkamilerAnn 共感してくださりありがとうございます😭
なんか、よく考えたら生活レベルの違いなのかな？とか思って来ました、かるくディスられてるんですよねきっと🤣
それでもまぁよしとしましょう！ww",1410187602427211777,WokingmamaENARI,Wed Jun 30 10:44:59 +0000 2021
127,"友達に、今回のボーナス0.5ヶ月分だったって言ったら、「少なすぎて私なら転職する」って言われた。
私的には仕事がある有り難み、ボーナス頂ける有り難みを感じてるんですけどねー。
考え方は人それぞれだね。",1410082679240871938,WokingmamaENARI,Wed Jun 30 03:48:03 +0000 2021
128,"日焼け止め自分で塗りたい！から始まって、今朝は次女大爆発でした💦
何してもダメだったけど、最終保育園の先生に抱っこされて落ち着いた🤣
ママより先生かよ！子供は素直。
先生、あざーす！！！",1410011815220715520,WokingmamaENARI,Tue Jun 29 23:06:28 +0000 2021
129,"おはようございます☀
月末ですねー。もぅ6月終わりか、早いなぁ。そして7月！夏だ！って感じではなく梅雨だね〜。",1409974497311035393,WokingmamaENARI,Tue Jun 29 20:38:10 +0000 2021
130,@akitj0711 それはキレますね🤣,1409771804055326720,WokingmamaENARI,Tue Jun 29 07:12:45 +0000 2021
131,"楽天で6月半ばにマスク買ったのに、まだ届かなかったから、昨日いつ発送か問い合わせしたら、発送しましたって連絡きた。
忘れてた？よね？",1409710483058290694,WokingmamaENARI,Tue Jun 29 03:09:04 +0000 2021
132,"朝のトイレに籠る時間🚽
ご飯食べてといてね〜と言い残し、ゆっくりしたいけど、母の監視がない2人は遊びながらダラダラ食べるんだよ🤣
トイレから出たら一口も進んでないのが現実です✋",1409632971141779464,WokingmamaENARI,Mon Jun 28 22:01:04 +0000 2021
133,"おはようございます☀
雨の音で目が覚め、目が覚めた瞬間にバイクのカゴにヘルメット入れっぱなしなことを思い出し、びしょびしょかも⁉️😱😱",1409613773837537282,WokingmamaENARI,Mon Jun 28 20:44:47 +0000 2021
134,"おはようございます☀
週末があっという間すぎた😭
今週は月末月初でバタバタしそうだ。頑張ろー！",1409252733748539393,WokingmamaENARI,Sun Jun 27 20:50:09 +0000 2021
135,"おはようございます☀
土曜日、6時に起きてルーティンこなしました🙌
やっぱり子供達が寝てる間に家事をこなすと楽だね〜🤣
そして、保育園でのシャワー&amp;プールが始まり、洗濯物山盛りの季節がやってきたね💦 https://t.co/lF18tDOhGd",1408553699220152320,WokingmamaENARI,Fri Jun 25 22:32:26 +0000 2021
136,@seikoazuma 最高です♪✨,1408201534437875713,WokingmamaENARI,Thu Jun 24 23:13:03 +0000 2021
137,@tyami_hiseiki 今月最後の週末、ってなんかしみますね✨,1408201393022722048,WokingmamaENARI,Thu Jun 24 23:12:29 +0000 2021
138,"そういえば昨日、不正出血の検査結果を聞いてきました。女性ホルモンが減ってきているんだとか。先生に原因を聞くと「40歳過ぎたらだんだんね〜」って、私まだ31歳ですけど🤣🤣
病気じゃなくて、本当良かった💕",1408191412168888322,WokingmamaENARI,Thu Jun 24 22:32:50 +0000 2021
139,"おはようございます☀
なんで蒸し暑いんだ💦
朝から娘が首を掻いてる。掻かないで〜って言いながら、気持ちがすごい分かる🤣",1408184581186981889,WokingmamaENARI,Thu Jun 24 22:05:41 +0000 2021
140,"@seikoazuma いーなー💕いーなー💕
楽しんできてください😆",1407900978280427527,WokingmamaENARI,Thu Jun 24 03:18:45 +0000 2021
141,"おはようございます☀
ベランダでタバコ吸うんだけど、どこかから卵焼きの良い匂いがする〜💕",1407798850450980865,WokingmamaENARI,Wed Jun 23 20:32:56 +0000 2021
142,"今日は昼からバタバタで全然仕事終わらなかったぞ💦
明日また頑張ろ！",1407643450409852928,WokingmamaENARI,Wed Jun 23 10:15:25 +0000 2021
143,"@4mama_PT 本当ペコペコしてますよ😭
回復した娘は今頃元気にお昼ご飯食べてるかな💕",1407537780591239168,WokingmamaENARI,Wed Jun 23 03:15:32 +0000 2021
144,"2日休んで仕事山盛りかと思ったけど、ある程度済ませてくれてた🥺ありがたき幸せ💕
さ、お弁当食べながら読書タイムしよ♪",1407537504350183425,WokingmamaENARI,Wed Jun 23 03:14:26 +0000 2021
145,"@nikochan4645 うちも4歳2歳です💕
姉妹です👧",1407472422811435008,WokingmamaENARI,Tue Jun 22 22:55:49 +0000 2021
146,"親友の妹が、今日陣痛促進剤2日目💦
促進剤ってほんときついんだよねー😭
頑張れーっ！！！",1407452710148837378,WokingmamaENARI,Tue Jun 22 21:37:29 +0000 2021
147,"おはようございます☀
今日は仕事に行きます！娘も回復！
出社したら「すいませんでした」と、平謝り連発の必殺技使おう✊",1407436465496154114,WokingmamaENARI,Tue Jun 22 20:32:56 +0000 2021
148,寝てくれ、昼寝を、してくれ。。。,1407218408932790275,WokingmamaENARI,Tue Jun 22 06:06:28 +0000 2021
149,"2日休んだだけなのに、仕事がしたいと思う。
きっと私が専業主婦だと、だらけまくって中身のない人生を送るんやろな。
そう思うときちんとしてる専業主婦の人って、相当意思強いよね！さすがっす👏",1407192823938523139,WokingmamaENARI,Tue Jun 22 04:24:48 +0000 2021
150,"おやつ食べてるのに喧嘩する2人。
喧嘩したからおやつ食べさせたわけでは無く、おやつを食べ出したら喧嘩しだした2人。
おやつくらい静かに食べて？",1407149914434400258,WokingmamaENARI,Tue Jun 22 01:34:17 +0000 2021
151,@E8bMdEd7ahsjw5a 気をつけて下さい💦,1407121927915769856,WokingmamaENARI,Mon Jun 21 23:43:05 +0000 2021
152,"おはようございます☀
今日も熱下がらず休みです💦貴重な平日の休み、掃除とか整理とか、何かしたいけど子供達がいると出来ないんだろぅなぁ。",1407104318960898077,WokingmamaENARI,Mon Jun 21 22:33:07 +0000 2021
153,結局今日は保育園お休みでした。おたふくではないっぽく、熱は37.1くらいでほんにんめっちゃ元気🤣でも公園行けないし逆にこっちが疲れるやつ。,1406880822162956288,WokingmamaENARI,Mon Jun 21 07:45:01 +0000 2021
154,"おはようございます☀
朝から病院連れて行かねば！",1406712392503861249,WokingmamaENARI,Sun Jun 20 20:35:44 +0000 2021
155,"@seikoazuma そうなんですね💡
なら良かったです☺️でも…次女にも…うつるやつですよねきっと🤣",1406474325587161092,WokingmamaENARI,Sun Jun 20 04:49:44 +0000 2021
156,"@seikoazuma まぢですかー😭😭😭
これから熱上がってくるのか💦つら。",1406464253813424128,WokingmamaENARI,Sun Jun 20 04:09:43 +0000 2021
157,"4歳9ヶ月女の子。
今朝から右耳後ろら辺の腫れ。触ると痛いらしい。噛むのも痛い。触ると熱い。
ぐったりではないけどいつもより元気ない。
1時間くらい前から37.4度の微熱。
これ、おたふくですか？？？",1406461451607236612,WokingmamaENARI,Sun Jun 20 03:58:35 +0000 2021
158,"おはようございます☀
起きられない日曜日…
次女昨夜は3回も夜泣き💦しかも爆泣き。
体が夜泣きに慣れてないからめっちゃしんど〜。",1406410567942692866,WokingmamaENARI,Sun Jun 20 00:36:23 +0000 2021
159,体調がすこぶるおかしい。,1406188999115345924,WokingmamaENARI,Sat Jun 19 09:55:57 +0000 2021
160,"おはようございます☀
今日次女アトピーの病院なのに寝坊した💦
あと5分で出ないと💦",1406038009783275520,WokingmamaENARI,Fri Jun 18 23:55:59 +0000 2021
161,長女のメガネ、作り替えました〜！ https://t.co/YDmxVeigge,1405764944214171651,WokingmamaENARI,Fri Jun 18 05:50:55 +0000 2021
162,"おはようございます☀
4:40分に珍しく次女が夜泣きして、20分寝坊だ💦
今日はそんな次女ちゃん2歳のお誕生日です💕仕事してるといつもと変わらない平日なんだよね💦",1405629926036762629,WokingmamaENARI,Thu Jun 17 20:54:24 +0000 2021
163,@tana_car9 流石に帰りに入れました🤣,1405473268815912962,WokingmamaENARI,Thu Jun 17 10:31:54 +0000 2021
164,"あれから不正出血が続いたので、今日病院へ行って来ました！
生理みたいなもんやね。ってww
排卵機能障害らしいっす。過去にも聞いたような🤔詳しく検査をして1週間後に結果だ！ただのホルモンバランスの乱れであってくれ🙏",1405473172904763395,WokingmamaENARI,Thu Jun 17 10:31:31 +0000 2021
165,"@tana_car9 めっちゃ高いですよねー💦
思わずスタンド通り過ぎてしまいましたww",1405338233899163648,WokingmamaENARI,Thu Jun 17 01:35:19 +0000 2021
166,"@yukkeblog おはようございます☀
ほんと気付けば🤣頑張りましょう！",1405302181037690882,WokingmamaENARI,Wed Jun 16 23:12:03 +0000 2021
167,"ガソリン高すぎません？
ずっと149円で、先週147円になって、ちょっと下がったなーとか思ってたら、今朝は157円💦
ハイオクかよ😭",1405302071226630145,WokingmamaENARI,Wed Jun 16 23:11:37 +0000 2021
168,"おはようございます☀
今日も忙しくなりそうだー。",1405264668621369344,WokingmamaENARI,Wed Jun 16 20:43:00 +0000 2021
169,"@DaraInCA 一度調べて見ます！
ありがとうございます🙇‍♀️",1404973670242545666,WokingmamaENARI,Wed Jun 16 01:26:40 +0000 2021
170,"@DaraInCA え、ワクチンでですか？💦
初めて聞きました💦
母は1回目打ちましたが…",1404936770337206278,WokingmamaENARI,Tue Jun 15 23:00:03 +0000 2021
171,"おはようございます☀
雨だねー、これくらいなら余裕だっ！",1404936571892035584,WokingmamaENARI,Tue Jun 15 22:59:15 +0000 2021
172,"生々しくてごめんなさい。
1週間前に生理が終わりました。先程出血がありました。妊娠の可能性0%、ポリープ手術2回経験。なにこれ？またポリープ？ビビり倒しております😱😱😱😱😱😱😱😱😱😱😱😱😱😱",1404805539905904650,WokingmamaENARI,Tue Jun 15 14:18:35 +0000 2021
173,"@litts30175226 ありがとうございます💕
気にいるのがあったみたいで、仕上がりが楽しみです😊",1404575645863084035,WokingmamaENARI,Mon Jun 14 23:05:04 +0000 2021
174,"@b56sjEfbjCr3Lw6 人知れず泣く夜も、育児頑張る上では必要ですよね☺️
今日も頑張りましょう🙌",1404575493567905792,WokingmamaENARI,Mon Jun 14 23:04:28 +0000 2021
175,"おはようございます☀
昨日は娘の弱視検診で、メガネ作り直しました👓色々思うところがあり、夜飲みながら涙したから、今朝はびっくりするくらい目腫れてる🤣🤣🤣",1404537457824059398,WokingmamaENARI,Mon Jun 14 20:33:19 +0000 2021
176,"おはようございます☀
昨日は昼からガンガン飲んで、21時に寝落ちからの今朝は30分寝坊でした😅
めっちゃ寝たー！",1404197563989823488,WokingmamaENARI,Sun Jun 13 22:02:42 +0000 2021
177,"誕生日、無事に仲直り出来ました💕
手抜きな私は誕生日会なのに王将で餃子と焼きそば持ちかえりwwしかも誕生日の主人に行かせるww持って帰ってきた袋開けたら中身全然違うし🤣電話したらちゃんと届けてくれました🙌王将さん、ありがとう！",1404033438668099586,WokingmamaENARI,Sun Jun 13 11:10:32 +0000 2021
178,"おはようございます☀
今日は主人と兄と娘の誕生日会🎊
今日は主人の誕生日当日！なのに昨夜喧嘩してしまった💦",1403843973081305089,WokingmamaENARI,Sat Jun 12 22:37:39 +0000 2021
179,"おはようございます☀
土曜日なのに5時半に起きた💦もっと寝てて良いのに目が覚めた💦もっかいねようかな。",1403452630685257730,WokingmamaENARI,Fri Jun 11 20:42:36 +0000 2021
180,Twitter始めたからなのかな？ww https://t.co/n9LnGTw67X,1403308253577060352,WokingmamaENARI,Fri Jun 11 11:08:54 +0000 2021
181,"おはようございます☀
金曜日なのに、寝坊せず起きれた😆",1403088083180933120,WokingmamaENARI,Thu Jun 10 20:34:01 +0000 2021
182,@b56sjEfbjCr3Lw6 アイス食べながらハイボールを飲みながら、録画見ました💕最高！ww,1402997583526592525,WokingmamaENARI,Thu Jun 10 14:34:25 +0000 2021
183,"最終的に、リビングで寝出す。まぢかよ。ベットへ行くよう促すこと3回。やっと次女連れてベット行った。
彼がいなくなったリビング、ストレスもなくなった💕
ちなみに旦那には不満は一言も言ってません。むしろ、期待してないよね。ww",1402985809989423113,WokingmamaENARI,Thu Jun 10 13:47:37 +0000 2021
184,"そしたらさ？エアコンつけてる旦那。え？は？ん？こっちはクッソ暑い中、寝ようと頑張ってるのに😨
そして私は掃除開始。あそぼーという次女をフル無視でテレビ見る旦那。え？は？ん？",1402985505210265612,WokingmamaENARI,Thu Jun 10 13:46:25 +0000 2021
185,週末来客があるし、最近全然床拭けてなかったから、今日は寝かしつけた後床拭く！って2日前から宣言してました💡暑さのせいでなかなか寝ない次女。とゆうか寝る気配ないし、時間だけがどんどんすぎる…寝かしつけ諦めて次女とリビングに戻りました！,1402985160161730582,WokingmamaENARI,Thu Jun 10 13:45:03 +0000 2021
186,@kimichanchanko 分かります。私も切り替えが下手で、イライラした気持ちがずっと残ってしまいます💦,1402874823924097030,WokingmamaENARI,Thu Jun 10 06:26:36 +0000 2021
187,"会社で仲良くしてくれていた人が、今日で定年退職…寂しいなぁ。
でも定年まで数十年勤めあげて、尊敬だなぁ💕",1402825117239955460,WokingmamaENARI,Thu Jun 10 03:09:05 +0000 2021
188,"おはようございます☀
20分寝坊したうえに、次女起きた。バタバタした朝になりそうだ。",1402733235700830210,WokingmamaENARI,Wed Jun 09 21:03:59 +0000 2021
189,"おはようございます☀
気持ち切り替えて今日も頑張ろう！",1402364515312824323,WokingmamaENARI,Tue Jun 08 20:38:49 +0000 2021
190,@tyami_hiseiki そんなに上げていただけると、救われます😭💕,1402238374434414593,WokingmamaENARI,Tue Jun 08 12:17:35 +0000 2021
191,"@b56sjEfbjCr3Lw6 ありがとうございます😭
アイス食べます🍨",1402203606787313665,WokingmamaENARI,Tue Jun 08 09:59:26 +0000 2021
192,"@wm_minamo ありがとうございます😭
明日はミスらないように、自分自身も祈ります🙏",1402203531952623650,WokingmamaENARI,Tue Jun 08 09:59:08 +0000 2021
193,"@tyami_hiseiki ありがとうございます😭
ヒューマンエラーがなくならないとは言え、半年に一度くらいはミスってしまってお客さんにも、工場にも迷惑をかけてしまう自分がいやになります💦",1402203422107979776,WokingmamaENARI,Tue Jun 08 09:58:42 +0000 2021
194,今日はミス。完全に自分が悪い。へこむー😭😭😭,1402168595421962242,WokingmamaENARI,Tue Jun 08 07:40:18 +0000 2021
195,"おはようございます☀
朝の空は嫌なことを忘れて清々しい気持ちにさせてくれる💕
この静かさが好きです。",1402001464365518848,WokingmamaENARI,Mon Jun 07 20:36:11 +0000 2021
196,"@seikoazuma ありがとうございます😭💕
かすり傷、2.3日で治りそうです☺️",1402001205484654593,WokingmamaENARI,Mon Jun 07 20:35:09 +0000 2021
197,仕事で嫌なことがありました。聞こえる声で嫌味を言われました。割り切って放っておけばいい！と思う自分と、相手が部長やから評価とか、出来ない人間と思われることに怯える自分がいる。弱いなぁー自分。,1401843675479494658,WokingmamaENARI,Mon Jun 07 10:09:11 +0000 2021
198,"おはようございます☀
週末子供達と走り回って、体中が筋肉痛です🤣",1401660572253392898,WokingmamaENARI,Sun Jun 06 22:01:36 +0000 2021
199,"おはようございます☀週末、雨が止んで良かった！
昨日金曜ロードショーでさ、ボヘミアンラブソティ見て、めっちゃ面白かったー！吹き替えだったから次は字幕で見たい！！でも録画し忘れた🤣",1400939612072120326,WokingmamaENARI,Fri Jun 04 22:16:46 +0000 2021
200,雨の日は、カッパの帽子をかぶってからヘルメットを被るとゆう技を最近覚えましたが、今日はヘルメットの中の帽子のポジションが悪くて、何だかずっとむずむずしてました😓,1400593182912516097,WokingmamaENARI,Thu Jun 03 23:20:11 +0000 2021
201,"おはようございます☀
今週最終日にして、初めて寝坊せずに起きれました😓",1400552173222588417,WokingmamaENARI,Thu Jun 03 20:37:13 +0000 2021
202,本を読んで、育児はどう変わったのか？週末記録です！ https://t.co/1ZQqUctW9M,1400350288712663044,WokingmamaENARI,Thu Jun 03 07:15:00 +0000 2021
203,長女の高い位置のポニーテールが可愛い❤️,1400216120968171523,WokingmamaENARI,Wed Jun 02 22:21:52 +0000 2021
204,"おはようございます☀
忙しい木曜日、気合入れていくぞー！！！",1400192486429978624,WokingmamaENARI,Wed Jun 02 20:47:57 +0000 2021
205,@nikochan4645 奨学金返済！,1399867750332305408,WokingmamaENARI,Tue Jun 01 23:17:34 +0000 2021
206,"おはようございます☀
唇の上にニキビができて、痛い💦",1399833303310422017,WokingmamaENARI,Tue Jun 01 21:00:41 +0000 2021
207,読書感想文書いたよ！文章力は小学生だよ！ww https://t.co/AWPXti8E5z,1399675831899721732,WokingmamaENARI,Tue Jun 01 10:34:57 +0000 2021
208,"おはようございます☀
気持ちいい朝だね！
月食、忙しいぞー💦",1399464765341147140,WokingmamaENARI,Mon May 31 20:36:15 +0000 2021
209,今日から現場京都のパパ。ワンオペ始まった今日、順調にこなして20時半ベットインしたのに次女が遊び出して21時パパ帰宅で起きてしまい、パパと寝る〜って言うから2人で寝かしつけして2人で寝落ち🤣今起きて夫婦で疲労困憊です😭,1399363707063345155,WokingmamaENARI,Mon May 31 13:54:41 +0000 2021
210,@ikuji_career その人はすぐ立ち上がって罵声を浴びせるほど元気でした🤣,1399363101418409995,WokingmamaENARI,Mon May 31 13:52:16 +0000 2021
211,ひき逃げを見たのに、咄嗟のことで何もできなかったことが悔しい。。。,1399141954470875138,WokingmamaENARI,Sun May 30 23:13:31 +0000 2021
212,"おはようございます☀
月曜日から20分寝坊😅
さ、1週間がんばるぞーっ！",1399106383702740993,WokingmamaENARI,Sun May 30 20:52:10 +0000 2021
213,@furukaw38221345 うちも昨日おじきそうの種を蒔きました！早く目が出たところを見る娘の姿がみたいなぁ💕,1398791361961238529,WokingmamaENARI,Sun May 30 00:00:23 +0000 2021
214,@takafumin0707 優しい旦那さんだ😭,1398791122307059712,WokingmamaENARI,Sat May 29 23:59:26 +0000 2021
215,"おはようございます☀
今日も良い天気！公園行くぞー！",1398782177404276738,WokingmamaENARI,Sat May 29 23:23:53 +0000 2021
216,"@omochi_benrishi もっと優しくして！とか、寂しい！とかママすぐ怒るもん！とか、結構刺さりますよね😭
でも逆に私が怒鳴った時に言ってる言葉も、刺さってるんだなと思います😩
少しずつ、成長していきましょう☺️",1398767138253402117,WokingmamaENARI,Sat May 29 22:24:08 +0000 2021
217,"遅くなりましたが、おはようございます☀
天気が良いのでお風呂マット洗濯です♪",1398432159279423491,WokingmamaENARI,Sat May 29 00:13:03 +0000 2021
218,@seikoazuma いやいや、そんな褒められたものじゃないです💦多分家の中の私を見たら、引くくらいひどいです🤣そんな自分にも疲れてしまって、子供達と過ごす時間が楽しくなくなって…やばい！と思いました😓,1398418453736820740,WokingmamaENARI,Fri May 28 23:18:35 +0000 2021
219,"@yutanpozubora そぅなんです、疲れるし、休みたいし、好きなことやりたい葛藤と戦いますよね👊
本を読んでいたら頭では理解できるんですけど、それを実践できるかどうか…また感想お伝えします☺️",1398417743817285632,WokingmamaENARI,Fri May 28 23:15:46 +0000 2021
220,@ikuji_career ママは1番の理解者でいて欲しいんでしょうね☺️でもママは気持ちが読めるスーパーマンではない🤣自分がイライラした時に主人に甘えられると、余計イライラしますよね😖分かります！！！私もしょっちゅうです！💦,1398416288716709893,WokingmamaENARI,Fri May 28 23:09:59 +0000 2021
